{
  "schema_version": "1.1",
  "skill_version": "1.2.0",
  "mode": "REPO_REPRODUCE",
  "profile": "standard",
  "created_at": "2026-10-01T00:00:00Z",
  "paper_id": "paper_example",
  "repository_id": "repo_example",
  "target_claims": [
    {
      "claim_id": "claim_table2_example",
      "type": "table_result",
      "paper_locator": "Table 2 / Ours / ExampleSet",
      "statement": "The method reports 84.7% accuracy.",
      "metric": "accuracy",
      "reported": {
        "value": 84.7,
        "unit": "%",
        "variation": {
          "kind": "std",
          "value": 0.3
        },
        "aggregation": "mean over 3 seeds"
      },
      "scope": {
        "dataset": "ExampleSet",
        "dataset_version": "paper version",
        "split": "test",
        "model": "Ours",
        "condition": "default",
        "config": "configs/main.yaml",
        "seed_policy": [
          1,
          2,
          3
        ],
        "checkpoint": null,
        "evaluation_protocol": "paper-described evaluation"
      },
      "comparison_rule": {
        "kind": "reported_variation",
        "predeclared": true,
        "parameters": {
          "basis": "paper-reported standard deviation"
        }
      },
      "unknowns": []
    }
  ],
  "resource_plan": {
    "accelerator": "GPU",
    "memory_class": "unknown until repository audit",
    "storage_class": "unknown until dataset audit",
    "duration_class": "unknown until smoke test",
    "full_training_required": false,
    "notes": "Example only"
  },
  "notes": "Illustrative contract; values are fictional."
}
